{"addons":{},"base_url":"https://raw.githubusercontent.com/tpruittguitar/forge-coordination/main/runtime/releases/d3473d594947a87bc7cc/","external_rules":{"blob_sha":"1633977287001ddf0f4aa21b98d630b5710b6222","path":"rules/TIM_PIPELINE_RULES_CANONICAL.txt","repository":"tpruittguitar/forge-policy"},"lanes":{"FORGE_APPLICATION_WRITER_GOFER":{"blob_sha":"a28b07f8f2cf5f4493111af9189c4e638cda74ea","estimated_tokens":4118,"file":"FORGE_APPLICATION_WRITER_GOFER.txt","owner":"Claude","sha256":"623061806e5af91bc6b7d544b0cf95b53887e1a7eaf626c12ac85dc2f5f68c33"},"FORGE_EMAIL_DISCOVERY":{"blob_sha":"0a96c32dd2a88d5c30c98244cd01e877a35c2caf","estimated_tokens":4797,"file":"FORGE_EMAIL_DISCOVERY.txt","owner":"ChatGPT","sha256":"469c5edc2e36484d146048e3e067a44360e59f884c050dc1a19847e68164e960"},"FORGE_ENRICH_FEASIBILITY":{"blob_sha":"79a72c47c315014741be9a14abb73eacf5d6f42d","estimated_tokens":4600,"file":"FORGE_ENRICH_FEASIBILITY.txt","owner":"Grok","sha256":"88b45f7b3f24ca95fb2a11d969079849e4bb6b3125ac3a73d28021c13a2bc13d"},"FORGE_ENRICH_STRATEGIC":{"blob_sha":"efb00b7779b695b9507e351c181c16e676415739","estimated_tokens":3878,"file":"FORGE_ENRICH_STRATEGIC.txt","owner":"Grok","sha256":"39a205fc49ec52606baba28c02298c76cc98a2e058225a588d194a80b9b73735"},"FORGE_POSTING_VALIDATION":{"blob_sha":"5e353f55fe1676440b45f8f990fdc9b9a07af8c7","estimated_tokens":3997,"file":"FORGE_POSTING_VALIDATION.txt","owner":"Claude","sha256":"535c7851eb5ef8513b16b03d261e10cabc56cd6f7e197e003e3c82b8a129339b"},"FORGE_WEB_CAREER_DISCOVERY":{"blob_sha":"93aee42e33ef3e936e6b01aec4f2dbe318e80c33","estimated_tokens":3976,"file":"FORGE_WEB_CAREER_DISCOVERY.txt","owner":"Grok","sha256":"6b5a6d71850b779c448b615de0dea869d2f31bd134acf0bce5b79d9519eb2a64"},"FORGE_ZIPRECRUITER_WEEKLY":{"blob_sha":"3f11aa0edc8eb9bf07a15affe818b6beadfb881d","estimated_tokens":4662,"file":"FORGE_ZIPRECRUITER_WEEKLY.txt","owner":"ChatGPT","sha256":"56934a2021d82353135c29e76e1076c6984854d8e836e05f564a6c9a5b705021"}},"policy_revision":"2026-10-21.1","release_id":"d3473d594947a87bc7cc","rotations":{"Claude":{"0":"FORGE_ENRICH_STRATEGIC","12":"FORGE_ENRICH_STRATEGIC","15":"FORGE_ENRICH_FEASIBILITY","18":"FORGE_ENRICH_STRATEGIC","21":"FORGE_ENRICH_FEASIBILITY","3":"FORGE_ENRICH_FEASIBILITY","6":"FORGE_ENRICH_STRATEGIC","9":"FORGE_ENRICH_FEASIBILITY"},"Grok":{"0":"FORGE_ENRICH_STRATEGIC","1":"FORGE_ENRICH_STRATEGIC","10":"FORGE_ENRICH_FEASIBILITY","12":"FORGE_ENRICH_FEASIBILITY","13":"FORGE_ENRICH_STRATEGIC","14":"FORGE_ENRICH_FEASIBILITY","16":"FORGE_ENRICH_STRATEGIC","17":"FORGE_ENRICH_STRATEGIC","18":"FORGE_ENRICH_FEASIBILITY","2":"FORGE_ENRICH_FEASIBILITY","20":"FORGE_ENRICH_FEASIBILITY","21":"FORGE_ENRICH_STRATEGIC","22":"FORGE_ENRICH_FEASIBILITY","4":"FORGE_ENRICH_FEASIBILITY","5":"FORGE_ENRICH_STRATEGIC","6":"FORGE_ENRICH_FEASIBILITY","8":"FORGE_ENRICH_STRATEGIC","9":"FORGE_ENRICH_STRATEGIC"}},"schema_version":1,"writer_minimum":{"capabilities":["row_readback","request_result","receipt_index","intake","ruling","batch","upsert_application"],"version":68}}
